category,advice
stalking,Move to a well-lit public area immediately. Inform trusted contacts. Call 112 if unsafe.
harassment,Avoid isolated areas. Document incident safely. Report through official complaint channels.
threat,Preserve messages or call logs as evidence. Contact police immediately if danger escalates.
domestic violence,Contact women helpline 181. Seek shelter with trusted people. Do not remain in unsafe space.
rape,Seek immediate medical assistance. Do not change clothes. Report to nearest police station.
voyeurism,Do not confront alone. Preserve evidence and report to authorities.
